sentence	label
A Vietnam War veteran (Stern) has been using illegal drugs, but eventually decides that he wants to escape that life. But before he can leave it behind, an FBI narcotics agent (Savalas) recruits him to go undercover in Los Angeles to help expose other ex-soldiers who involved in drug dealing and drug kingpin Neilson (Vaughn).[8][9]	action
Marianne, a nightclub dancer, is on the run from vicious criminals. On her 21st birthday, she will inherit a vast fortune as well as some legal papers that will incriminate her father, a crooked judge. When her father invites Marianne to his estate in Portugal, a game of cat-and-mouse begins.[5]	horror
B.J. Hammer is a boxer who rises up the ranks with help from the Mafia. However, Hammer doesn't realize that the help comes with a price: He is asked to throw a fight. Gangsters threaten to harm his girlfriend in an attempt to force him to go through with their plan. Hammer is forced to figure out a way to save his dignity and the life of his girlfriend, who has been kidnapped by gangsters.	action
Teenager Johnny returns to his hometown in New England to try to find out who his father is. There has recently been a string of murders, so Johnny is immediately suspect. In the process of trying to find out who his father is, Johnny discovers that there was an entire story that he did not know.	thriller
Five young women named Beth, Brea, Carla, Heather, and Heather's cousin Paula take their summer vacation together at a resort on Lake Arrowhead, where they go to parties and become involved with local men. However, things go haywire for the women when a mysterious killer targets them.[2]	thriller
Eddie Collins finds that he is unable to perform sexually with women because of repressed memories of his mother. After accidentally killing a woman while trying to sleep with her, he finds that he is able to get aroused by the dead body. This leads him into a chain of luring women into bed in order to kill them for sexual gratification.	thriller
"A TV news program does a segment on Terminal Island, an off-shore island established after the abolition of the death penalty. First degree murderers are shipped off to spend the rest of their days fending for themselves.
Carmen is dropped off at Terminal Island. The first prisoner she meets is a former doctor. She comes to realise there are two main factions on the island. A civil war breaks out."	action
The Grandview is a sprawling Californian hotel with a terrible secret: single blonde visitors who check in don't check out. Hotel detective Rick Stewart (David Bailey) begins investigating what's happened to a handful of vanishing guests but he soon becomes personally involved when his brunette ex-wife, Lisa James (Tiffany Bolling), arrives for a singing engagement at the hotel. When Lisa dons a blonde wig for her performance, she finds herself the next target of a psychopathic killer.	horror
The Arena, set in the ancient Roman town of Brundusium, is about a group of slave girls who are sold to a man named Timarchus (Daniele Vargas), the organizer of the events that take place in the town’s colosseum. After a fight breaks out amongst the girls, Timarchus gets the idea of putting the women in the ring to fight to the death. The recently captured Mamawi (Pam Grier) and Bodicia (Margaret Markov) realize they must stick together if they are to survive.	unknown
A bank temporarily housed in a mobile home while a new building is built, looks like an easy target to break into. On the other hand, why not steal the whole bank, and rob it in a safer location?	unknown
A private detective takes a case involving a religious cult and a movie star's death.	unknown
J.J. (Rod Perry), a rising star in the black crime scene, is in the process of consolidating his power over the neighborhood. One of the only remaining obstacles is the white heroin cartel that is understandably reluctant to abandon such a lucrative market. Tensions rise, and an explosive confrontation is the result.	unknown
Noble nightclub owner Samson does his best to keep his neighborhood clean of crime and drugs. When vicious mobster Johnny Nappa tries to muscle in on Samson's territory, Samson takes a brave stand against Nappa and his flunkies.	unknown
Two vice squad detectives investigate a series of crimes, with varying degrees of success. They change their focus to trying to bust LA crime kingpin Carl Rizzo, whom they believe to be responsible for much of the criminal activity they have been investigating.	unknown
After being selected at random by a computer to seek safety in an underground bomb shelter on the eve of a nuclear attack, a group of refugees makes a horrible realization: They are sharing the space with a colony of vampire bats. And since going back above ground is not an option, they are forced to stay and fight for their lives.	unknown
A Vietnam veteran who lives at the V.A. Hospital escapes and builds an underground fortress next to the highway. He keeps it decent and plans some other actions, including getting free light and phone service. While a few people and the police try to find him, Vrooder finds love with a doctor, Zanni.	unknown
Joe (Hal Holbrook) is a cynical American journalist assigned to work in the Soviet Union, where he meets Oktyabrina (Goldie Hawn), a spirited and erratic Russian ballet dancer who lives illegally without proper documents. Their ensuing romance opens new possibilities for both; but also draws the attention of the Soviet authorities.	unknown
A legendary statue has seven gold needles inserted in it, and an adult man will become a sexual superman when the needles are placed in the same position in his body. A colorful group of characters is all in on the hunt for the mysterious statue.	unknown
Two West Virginia brothers quit their jobs as coal miners in order to make their fortune from armed robbery.	unknown
"Among the skits are:
Several spoof TV commercials are featured, including a few for the fictional Uranus Corporation (pronounced with the stress on the second and third syllables). One Uranus commercial touts the amazing properties of its space-age polymer product ""Brown 25"" (which looks suspiciously like human feces): ""It has the strength of steel, the flexibility of rubber, and the nutritional value of beef stew."""	unknown
A group of pilots in the Canadian wilderness begin to hear strange reports over their radios about planes crashing, cars stalling, and a deadly plague which has gripped the planet. As the plot continues, it's clear that Earth is in the midst of an invasion. The pilots barracade themselves in a cabin in the woods and wait for impending doom.	unknown
Vince Newman, a no-nonsense cop, decides to investigate on his own when tipped off that colleagues in the police department are involved in a drug ring.	unknown
"Working for a local crime boss, the ""key-man"" known as Cooper (Jason Miller) runs a set of warehouses in Los Angeles. Just as he is about to close a deal that will net them a whole block of L.A. turf, problems arise. As he continues to talk to the police and has a relationship with a young woman (Linda Haynes), Cooper's pals wonder if he is planning to reveal other things about their plans. Trouble is afoot."	unknown
Newlyweds David and Jill Webb (Dack Rambo and Rebecca Dianna Smith) want nothing more than to consummate their marriage in New Orleans. But on their way to “The Big Easy,” they witness a murder. When the sadistic killer (John Beck) realizes he’s been caught in the act, he knocks David unconscious and rapes Jill. Eventually, David learns the story of his wife’s assault and sets out on a relentless vendetta to find the rapist and his partner and bring them to justice. [2]	unknown
The residents of a large town are inexplicably turning into rhinoceroses. Stanley (Gene Wilder), a mild-mannered office clerk, watches the bizarre transformations from a bemused distance. But soon the strange occurrences invade his personal space, as his neighbor and best friend John (Zero Mostel) and his girlfriend Daisy (Karen Black) become part of the human-into-rhinoceros metamorphosis that is taking place. Eventually, Stanley realizes he will be the only human left.[2]	unknown
Horror writer Edmund Blackstone (Jonathan Frid) sees his recurring nightmare come to chilling life one weekend as one by one, his friends and family are killed by three villains: the Queen of Evil (Martine Beswick), a dwarf named Spider (Hervé Villechaize), and a giant scar-faced strongman called Jackal (Henry Judd Baker).[3]	unknown
"Vonetta McGee plays Thomasine and Max Julien plays Bushrod in a film intended as a counterpart to the 1967 film Bonnie and Clyde.
Thomasine and Bushrod go on a crime spree through the American south between 1911 and 1915, acting as Robin Hood type heroes who steal from rich, white capitalists, then give to Mexicans, Native Americans and poor whites."	unknown
Roman Catholic priest Father Charlie and former police officer Lee solve a bank robbery mystery that stretches across the city. After Lee is removed from the force due to $1,000,000 being stolen from the bank, Father Charlie helps him to gain revenge for the loss of one of his friends.	unknown
"Within 24 hours, three near-fatal accidents have occurred. At the scene of each, the letter ""W"" is scrawled over the injured person. Katie Lewis (Twiggy) and her husband Ben (Michael Witney) discover that these accidents are in fact the work of a mysterious killer, and that they are the real targets. While trying to avoid death, the couple must struggle to discover the source of these attacks."	unknown
When three whalers become stranded in Northern Canada’s Arctic in 1896, they are rescued by Inuit. In the beginning, the Inuit accept the strangers' European ways, but as this increasingly influences and affects their customs, things slowly fall apart and cultural tension grows until the climax.	unknown
The story centers on Tom Skelton, a young man who opens a charter fishing business in Key West, Florida. He enters into a rivalry with a local sea captain named Dance and his partner Carter, who steal one of the new fishing guide's clients. Skelton retaliates by burning Dance's boat.	unknown
Fred Williamson stars as Duke Johnson, a man who arrives in Bucktown to bury his brother, a bar owner who was killed after refusing to pay crooked cops for protection. After arriving to Bucktown, he realize he needs help after being threatened himself. Duke calls his friend Roy (Thalmus Rasulala) and his gang to come and help, after arriving Roy's gang decided to take over the town. In order to gain control, Duke has to fight off Roy's gang all by himself.[1]	unknown
An earthquake releases a bunch of mutant cockroaches that can create fire by rubbing their cerci together. Eventually most of the bugs die because they cannot survive in the low air pressure on the Earth's surface, but a scientist, Professor James Parmiter (Dillman), keeps one alive in a pressure chamber. He successfully breeds the mutant cockroach with a modern cockroach, creating a breed of intelligent, flying super-cockroaches.	unknown
"A successful Los Angeles-based businessperson, doting father of two and a loving husband, Ron Lewis (John Daniels) turns into a completely different self at night – his alter ego, the ""Black Baron"", a prominent, powerful and feared pimp; but after killing two racist police officers in his pursuit, the Baron realises that his pimping days are numbered."	action
"The story begins with two government agents, Matthew Johnson and Melvin Johnson, being captured by the ""Dragon Lady"" (Stella Stevens). Cleopatra Jones then travels to Hong Kong to rescue the agents. Jones pairs up with Tanny (Ni Tien) and ends up in the Dragon Lady’s casino, which, in actuality, is the headquarters for her underground drug empire. Jones and Tanny use their combat skills to battle the Dragon Lady’s henchmen and rescues the agents.[2]"	action
British agents try to stop a communist returning home from the West.[1]	thriller
Sheriff Buford Pusser continues his one-man war against moonshiners and a ruthless crime syndicate after the murder of his wife in late 1960's Tennessee.	action
Kicks Carter is a streetwise policeman whose beat is Las Vegas. A crime gang is running guns, selling drugs, loan-sharking, and running a prostitution ring out of an upscale hotel in the city and Kicks is trying to put them out of business. But the interference of a woman reporter is making his job more difficult.	action
A man who makes liquor illegally from a still is in cahoots with the sheriff, who then double-crosses him. The moonshiner is shot dead by the sheriff's deputy. His two daughters decide to take over the family business, but when the sheriff and a corrupt local banker disrupt their operation and eventually destroy their still, the girls decide to get even.	action
After being released from a mental hospital, Jesse (Bridges) sets out to find and rejoin his off-beat family. While doing so, he meets a pretty young woman named Chloe (Sarandon) who works in a movie theatre, and they fall in love, which resolves his psychological problems.	romance
The wife, Ellen (Susannah York), of an international industrialist (Robert Culp) and her two children are kidnapped from their Athens home by a terrorist group and taken to an abandoned monastery on an imposing, needle-shaped island. Jim McCabe (James Coburn), Ellen's ex-husband hires a crew of professional hang gliders to help him rescue her and the kids from the terrorist's mountain top lair.[3]	action
When a powerful storm knocks Fly Creek, Georgia's power lines down onto wet soil, the resulting surge of electricity drives large, bloodthirsty worms to the surface and out of their soil-tilling minds. The townspeople soon discover that their sleepy fishing village is overrun with worms that burrow right into their skin. Inundated by hundreds of thousands of carnivorous creatures, the terrorized locals race to find the cause of the rampage before becoming tilled under themselves.	horror
"Abner Procane hires Raymond St. Ives, a crime reporter and ex-policeman, to return five ledgers stolen from his safe.
St. Ives becomes embroiled in the task and the deaths of those involved in the theft. The ledgers are eventually returned minus four pages, and St. Ives is drawn into robbery to try and right the situation."	action
A small California town is overrun with unruly and rowdy behavior from oil-field workers. Aaron Arnold, a Vietnam War veteran, and the brother of one of the locals (Ben Arnold), is hired to assist the police in restoring the peace. Aaron hires mercenaries trained in combat to help. After controlling the oil field workers, the veterans take over the town for their own not-always-legal purposes. Confrontation between the town police and locals and the mercenaries ends in violence.	action
"Barbara Broadcast, a world-famous liberated woman and best-selling author, is interviewed by a journalist about her successful career in an elegant Manhattan hotel restaurant, where gourmet food and erotic activities are on the menu[10][11] – a surrealistic ""Buñuelian"" atmosphere, according to one film reviewer.[12] Afterwards, other Manhattan moments in New York City are featured, including a corporate office encounter and a casual meeting in a busy night club.[10][11]"	unknown
L.A. bounty hunter, Zachary Kane, is on the hunt for a masked serial killer on the loose.	unknown
The story revolves around a group of people who work at The Back Bay Mainline, an alternative newspaper in Boston.[2]	unknown
After witnessing the traumatic suicide of one of his patients, and much to the chagrin of his loving wife Elaine (Diana Muldaur), well-respected psychiatrist Dr. Nicolas Mati (Telly Savalas) begins to become unhinged. As he loses the grip on his sanity, his obsession with a demure young student intensifies.[5]	unknown
Conway is Vernon Praiseworthy, only heir to his uncle's fortune, who faced poverty and misfortune during the Great Depression but managed to build up his riches despite these hardships. To become eligible for the inheritance, Vernon must suffer as his uncle did by becoming a migrant hobo for a time. Soon after, Vernon and the dog sent to protect him are caught up in a dognapping scheme	unknown
"Formula One auto racer Bobby Deerfield is a calculating, control-obsessed loner who has become used to winning the checkered flag on the track. But after he witnesses a fiery crash that kills a teammate and seriously wounds a competitor, Deerfield becomes unsettled by the spectre of death.
During a visit to the survivor, Deerfield's world is further set askew when he meets Lillian Morelli (Marthe Keller), a quirky, impulsive woman racing against time."	unknown
Guido Falcone (Terence Hill), an easygoing Italian mechanic, is heir to a billion-dollar inheritance after his uncle dies in a freak accident. In order to claim his inheritance, he must reach San Francisco within twenty days to sign a document. His uncle's greedy assistant John Cutler (Jackie Gleason) wants the money for himself, and hires a female detective (Valerie Perrine) to prevent him from reaching his goal.[3]	action
After a wave of unsolved car thefts, an insurance company calls in private investigator Pete Novick (Joe Don Baker) to solve the case. While the chief of police isn't thrilled about having an outsider come and show up his men, one of the officers is a former girlfriend of Novick's who's more than willing to help him out in any way she can. After a long and convoluted investigation with false leads, psychics and the mafia, Novick at last unravels the identity of the thief.	action
Moonshine runners in Florida who are trying to stay independent in the face of attempts by organized crime to take over their business.	action
Set in a working-class Bronx community, it tells the story of the De Coco family, a family of construction workers. Thomas is the head of the family with three sons, but one, Stony (Richard Gere) wants to be a teacher, not a hardhat. Then he accepts a job as a recreational assistant at a children's ward. Immediately, bitter divisions begin to surface.	unknown
As President Richard Nixon's Special Counsel, Colson had his own office in the White House, power and prestige. After Watergate he had a prison record… and a strong faith. Colson, played by Dean Jones, pleads guilty to Watergate-related charges and is sent to prison. The experience leaves him radically changed, and he decides to establish Prison Fellowship – a ministry that now reaches around the world.[1]	unknown
Neil Curry (Perkins) is living a happy life with his second wife Barbara (Berenson) in California after abandoning his first wife, Emily (Chaplin), in New York. Their life of domestic bliss is interrupted when Emily comes back from prison, where she served a 12-year sentence for murdering Neil's former lover. She arrives in California to wreak havoc and also to claim back Neil.[2]	thriller
The story follows a group of men traveling to a duck hunt in the Northwest. One of them, Charlie, is hoping to travel and forget the grief he has over his son's death in Vietnam. When he learns a young member of his party, David, is a deserter, Charlie goes berserk and hunts David.	thriller
"When a team of undercover narcotics officers is targeted by a serial killer, the police recruit karate champion Matt Logan (Chuck Norris) to bring the murders to an end. Narcotics Officer Amanda ""Mandy"" Rust (Jennifer O'Neill) discovers that a traitor within the police ranks is behind the killings."	action
Colin Glasgow returns home after the murder of his uncle to find out that his uncle's will has been altered and his family is under a werewolf curse. Twists and turns lead to Colin finding his old love Lynn and meeting a priest who is more than meets the eye. In the end, Colin must find a way to end the curse that has haunted his family over the ages and will do so even if it costs him his life.	horror
A meteor strikes a houseboat in the swamps near a southern town, which causes the people on the houseboat to become zombies. When the zombies run out of alligators to eat, they begin killing people in the town. A local scientist tries to figure out how to stop the zombies.	unknown
The film explores the love triangle of real-life characters Neal Cassady, Jack Kerouac, and Carolyn Cassady in the late 1950s and the 1960s. It chronicles Jack Kerouac writing his seminal novel On the Road, and its effect on their lives.	romance
The plot offers a comic spin on adultery. When Greg crashes his sports car, doctor Evelyn comes to his rescue, and the two soon are engaged in an affair. Evelyn's workaholic husband learns about it from Greg's live-in girlfriend, scatterbrained television weather girl Stephanie, and the two begin to engage in a dalliance of their own. Complications arise when the two couples plan a clandestine weekend getaway at the same Acapulco resort.	romance
In the Salem of 1692, a group of witches are burned at the stake. Now, in the 1980s, a witch comes back from the dead, possesses one of her descendants, and goes hunting for the occupants of the town to avenge her death.	horror
Policeman Dante Matucci investigates a series of murders involving people in prominent positions. Left behind at each murder scene is a drawing of a salamander. As the body count grows he sees a pattern that might point to a conspiracy to take over the Italian government.	thriller
"Karl Kinsky (Dern) is a mentally ill tattoo artist who is hired to create temporary tattoos for some models. He becomes obsessed with one of them, Maddy (Adams), whom he kidnaps in order to force her to wear ""his mark."" He keeps her captive as he creates his masterpiece on her body. Throughout the ensuing captivity, Maddy tries several times to escape, but her attempts are continually thwarted by Kinsky."	thriller
"Detectives Mike Hammer and his one-armed friend, Jack Williams, who is discovered murdered. The plot also features a serial rapist and a sex therapy clinic headed up by Dr. Charlotte Bennett.
The plot contains elements not in the novel, such as government conspiracies and mind-control techniques by the CIA and the Mafia.[2]"	action
Jamie Douglas is a beautiful TV newswoman with a successful career in Los Angeles and a stable relationship with her boyfriend, Brandon. Derek is a psychopathic photographer who stalks her.	thriller
"When Los Angeles' police force down-on-her-luck businesswoman-turned-prostitute ""Princess"" to help capture a murderous pimp named Ramrod it's Princess's life that is put on the line. Soon, the escaped killer is after her, and vice squad detective Tom Walsh and his team are hard pressed to keep the woman safe."	thriller
"The film tells the story of missionary Nathaniel ""Nate"" Williamson, taken to an island mission with his fiancee Sophie. Their ship, the Rona, is captained by the roguish William ""Bully"" Hayes, who also takes a liking to Sophie. When Sophie is kidnapped by slave trader Ben Pease, ""Nate"" teams with Hayes in order to find her. The two men enjoy a friendly rivalry for Sophie's affections, and she is to some extent torn between them, though committed to Nate."	action
Princess Daisy tells the story of a young girl who is sent to England to live with her father, Prince Valenski, after her mother's death in a car crash. Unfortunately, Daisy is immediately separated from her twin sister Dani, who is a special needs child not accepted by their father. When Daisy turns 16, their father dies in a plane accident. The girl is forced to take care of her life herself, especially when her half-brother starts seeing in her more than just a sister.	romance
When Jonathon Ratcliff (Bottoms) suddenly becomes blind, doctors fit him with an experimental electronic device designed to partially restore his sight. With his renewed vision, he witnesses a murder and must stop a serial killer.	thriller
A serial killer who is an expert at martial arts is preying on strippers in Manhattan's Times Square. Night after night, he visits smoky strip clubs, waiting for his victims. The owners of the largest company of strippers in the city are Matt Rossi (Berenger) and Nicky Parzeno (Scalia). Rossi is a retired boxer who retired after having killed an opponent in the ring. He is now seeing their whole business under threat, at the same time as he fears that the woman he loves might be the next victim.	action
A telephone linewoman who teaches aerobics classes[1] is possessed by an evil spirit of a fallen ninja when coming to his aid. The spirit seeks revenge on those who killed him and uses the female instructor's body to carry out his mission. The only way the spirit will leave the aerobic instructor's body is through combat with another ninja.	action
A computer error leads to the accidental release of homicidal patient Howard Johns from a mental institution. The mute murderer returns to the scene of his original crimes.[2]	horror
Set in the context of the Sandinista government in Nicaragua and their battle with the U.S. backed Contra rebels. Eddie Guerrero (Robert Beltran) is a Mexican-American Vietnam vet sent to help U.S. Special Forces train Contra rebels. Eddie falls for a local girl, Marlena (Annette Charles). However, when her father is killed by the Contras things change.	action
At an elite school, a group of students who call themselves The Sentinels begin terrorizing their socially undesirable classmates. Soon, one of their targets ends up brutally murdered. An editor of the high school paper begins to investigate and The Sentinels become even more ruthless in their behavior.	unknown
