sentence	label
In World War II, American Gates Trimble Pomfret (Kent Smith) is in London during the Blitz to sell the ancestral family house. The current tenant, Lesley Trimble (Ruth Warrick), tries to dissuade him from selling by telling him the 140-year history of the place and the connections between the Trimble and Pomfret families.	drama
Webster Frye (James Dunn) and his newly-wed wife Jackie (Florence Rice) travel to an old house in the country for their honeymoon. They begin to think the house is haunted, but it turns out that the house is being used as a gangster hideout.[1][2]	comedy
In a Mexican nightclub, some American fight promoters witness Alberto 'Baby' Valdez, the brother of Lita Valdez knock out a champion fighter. At first Lita is angered that her brother has quit his law studies to become a fighter, but the two move to the United States. Lita literally bumps into reigning champion Jerry O'Leary with the three becoming inseparable friends. However the American fight promoters force Alberto and Jerry to fight each other or face suspension.	comedy
"Johnny Moon is a mob boss who controls everything from politicians to a profitable women's penitentiary he runs. He has ruined many lives, including that of Helen Martin, a teacher, and her sister Jean.
A political reformer, Frank Donovan, is able to persuade Helen to go undercover behind bars, posing as an inmate, to unearth evidence that will prove Moon's abuse of the incarcerated women. She ultimately succeeds, but not before placing her life in grave danger."	drama
Military officer Captain Craig Killian is wounded in the line of duty and taken to a private hospital in England. Killian soon learns the hospital is a front of Nazi operations that wish to damage English home defense efforts.	drama
"Hubert Wilkins is a bookkeeper and an air-raid warden in his town. He wants to marry Emily Conway, the company's secretary, but is short of money.
Both are fired after persuading the boss's son, Don Bates, to elope with Sally Conway, his sweetheart. But after Hubert uncovers a crime, he also discovers that he owns property worth $100,000."	comedy
Henry Aldrich becomes the most sought after guy in town when he wins a date with a movie star.	comedy
The plot tells of Penny's going to work in a munitions factory during World War II and falling in love with Joseph Cotten.[3]	romance
Written by Samuel Hoffenstein and Elizabeth Reinhardt, the film is about a young girl who visits New York City to see her half-brother, and to try to start a music career.	comedy
"In 1906, Tom Richards (James Cagney), a drifter, arrives in Plattsville and befriends newspaper proprietor Vinnie McLeod (Grace George), who is battling the corruption of the town's leading citizen W.M. Dougherty (Edward McNamara). He takes over as managing editor of the Plattsville ""Shield and Banner"" and, despite initial resistance from the oppressed citizens, finally drives Dougherty out of town."	comedy
"A young girl, Mary Tillet, portrayed by Mary McLeod, is forced to find a new place to live due to her London home being bombed during World War II. Her tobacconist landlord, Jack Rawling, portrayed by actor John Abbott, tries to help her turn her new apartment into a home. Meanwhile the newspapers are reporting news of the ""London Blackout Murders,"" a murder spree being committed against a ring of suspected Nazi spies, and Mary must determine if her kind landlord is an assassin."	drama
Lupe Vélez plays a dual role, twin sisters Rita and Elaine. After escaping a torpedoed ship, Rita shows up in Manhattan, where she takes the place of her Broadway-star twin sister Elaine, who's having problems with her marriage and needs to make a getaway. Neither Elaine's husband or Rita's saxophone-player boyfriend are aware of the switch.	comedy
"Beverly Ross (Ann Miller) wants to be a radio personality, but has to run the switchboard at a local station. The blustery station owner Mr. Kennedy (Tim Ryan) wants no part of programming the ""jive that she loves"", preferring the classics.[3]
After struggling to keep her time slot, Beverly broadcasts her show from an Army base.[4]"	comedy
The film takes place behind the scenes of a fictional vaudeville play. The story centers on a recently divorced woman. She decides to use her alimony settlement to produce her own show. Unfortunately her chief backer insists on starring in it. She is saved by a talented man, who puts everything on risk to replace the talentless chief backer.	comedy
Frank Buck tangles with Nazis who have been doping tigers in Malaya, thereby making man-eaters of them. With the cats on a rampage, rubber production is seriously curtailed and the Allied war effort jeopardized. Buck and his associates, Peter Jeremy, Geoffrey MacCardle and Linda McCardle, thwart the Teutonic malefactors: the villainous Nazi Dr. Lang (Arno Frey) and his portly accomplice Henry Gratz. Thereafter, life is safe once again in the jungle.	adventure
A bank clerk's life becomes a nightmare because he fits the description of a maniac killer.	film noir
Montez is the ruler of the tropical Temple Island, Thomas Gomez the villain who schemes to marry her and get hold of the gold bars lining the submerged floor of the island's temple (about which the innocent islanders remain blissfully unconcerned). Jon Hall plays a heroic shark hunter who wins the day and the heart of the princess.	adventure
Josephine Evans (Mary Astor) and Professor Michael Kingsley (Herbert Marshall) are in a romantic relationship, something not approved of by Evan's two children. They try to disrupt the relationship with salacious incidents taken from their mother's fiction books, presenting them as true things their mother has done, hoping Kingsley would be displeased.	drama
Lively teen Joan Lyons (Virginia Weidler) and her best friend, Patricia Drew (Jean Porter), are dedicated autograph seekers who run around New York City attempting to meet celebrities. Deceived by trouble-making governess Miss Featherstone (Agnes Moorehead), Joan is distracted from her star-chasing by concerns over her parents' marriage. This leads Joan to hire a muscle man named Dr. Hercules (John Carroll) to flirt with her mother, which only results in more misunderstandings.[3]	comedy
Dr. Gillespie has to finally choose his official assistant, or Red and Lee are going to kill themselves in competition. So, it's another diagnosis competition. Lee's assignment is a small girl who falls ill whenever she eats candy. Red has to cure a girl's mother of a debilitating case of arthritis. But when Red needs Lee's help, will either one live with Gillespie's choice?	drama
Arriving in Australia after the Battle of Guadalcanal, two Flagg and Quirt type American Marines compete with each other by stealing the other's Australian girlfriend. Their intense rivalry leads to their arrest and escape from confinement dressed as women.[1]	comedy
European immigrant Stefan Dubechek (Brian Donlevy) arrives in America in the 1890s and becomes involved in the steel industry. He eventually becomes an automobile manufacturer. And then, in World War II, a plane manufacturer.	drama
The physician at the Vienna Royal Theatre, Dr. Hohner (Karloff) murders his fiancee, a prima donna, out of obsession and jealousy. Ten years later, he hears another young singer (Foster) who reminds him of the late diva, and is determined to make her sing only for him, even if it means silencing her forever.	horror
A Romani princess descended from Marie LaTour has the ability to change into a wolf at will, just like her late mother. When she learns that Marie LaTour's tomb has been discovered, she decides to use her talent to kill everyone who knows the location, because it is a sacred secret that only her people are allowed to know.	horror
A shaken survivor of a ship sunk by a submarine travels to her aunt and uncle's Louisiana plantation to recuperate, but her relatives have other ideas.	film noir
Artist Dave Stuart is blinded by a jealous assistant. The father of his fiance offers an operation to restore his sight, but Stuart will have to wait until the man dies. The benefactor dies a premature death and Stuart becomes a suspect.	horror
A fugitive from the law (Curtis) leaps from a bridge, then gets a ride from a meek librarian (McDonald). After explaining how he became the victim of several double-crosses, he eventually finds refuge with a blind girl (Jean) and her father (Craven) at a secluded farmhouse.	crime drama
French jewel thief Lupin (Charles Korvin) robs an heiress (Ella Raines) on a train, then follows her to England and saves her life.	crime
The professional gambler Ross Hadley is the owner of a posh gaming establishment in the heart of New York. Hadley's main antagonist is his childhood friend Mike McGlennon. McGlennon, now a police lieutenant, is determined to stop the gambling activities of Hadley. Hadley's and McGlennnon's relationship becomes more complex, when they notice, that they both are in love with the attractive Mary Hayes. Mary sings in nightclubs under the stage name 'Vi Parker'.	crime
A king's messenger (Jon Hall) protects a Gypsy dancer (Maria Montez) from a wicked baron who knows her secret.	adventure
A neglected wife turns to an astrologer, who tells her she will meet and fall in love with a handsome stranger, much to the dismay of her astronomer husband.	comedy
The town of Pitchfork, Arkansas makes national headlines when Esmeralda the sow gives birth to 18 piglets. Among the visitors to Pitchfork are a troupe of showgirls hoping to entertain the visitors and a folk music group returning to their home after their touring is through. In addition to the artists a meat packing company sends two men to investigate what made Esmeralda give birth to so many piglets and to bring the secret back to increase meat production.	comedy
Andy (Lee Bowman) and Janie (Jean Arthur) Anderson are seated on opposite sides of a court room filing for a divorce. As the judge is about to render his verdict, Janie's father (Charles Coburn) makes a suggestion. In an attempt to save the marriage, William suggests that the couple return to San Francisco (where they met a year and a half ago) for four days and retrace all of their steps to include getting married.	comedy
"Clement (Gabin), a condemned murderer literally minutes away from the guillotine, is ""liberated"" when the Nazis bomb the French jail that holds him. During his escape he steals the uniform and identification papers of a dead French soldier. He then hides from the law by joining the Resistance movement. Clement's new identity and purpose in life reform him. In the end he sacrifices himself in service of his country."	drama
The movie is a musical account of the life of Ernest R. Ball, a gifted composer of many popular Irish songs, including the titular one.	comedy
Janie is a free spirited teenage girl living in a small town. World War II brings the establishment of an army camp nearby, which is opposed by her father, the local newspaper publisher. Janie and her bobby soxer friends have their hearts set afire by the prospect of so many young soldiers so close. She enjoys dating an Army man, which makes her younger local boyfriend jealous.	comedy
"As the Nazis come to realise that their dreams of world domination after World War II will not be fulfilled and that Germany is in fact about to be defeated, a fanatical hard core prepare for the future Fourth Reich and the continuation of the dream of Aryan supremacy in later generations. To this end, Nazi officer von Beck is sent to infiltrate a village in rural Belgium where he will wait to agitate again for racial supremacy for ""true Europeans"" over lesser, ""mongrel"" races."	drama
A man is keeping a secret from his young niece: he is an international jewel thief.	comedy
A racketeer gets his draft notice and becomes a soldier. He comes across a criminal organization while in the Army and decides to do something about it.	crime
The plot involves a U.S. effort to root out Nazi saboteurs at a shipyard during World War II. Pat O'Brien plays an American intelligence officer who goes undercover at the yard, working at a construction job and looking for possible spies among the managers and employees.	drama
The storyline unfolds as a series of humorous anecdotes about Marion Hargrove's tenure in the U.S. Army while at boot camp in Fort Bragg, NC during the early days of World War II.	comedy
A poor family in Florida saves all the money they can in order to plan a Sunday dinner for a soldier at a local Army airbase. They don't realize that their request to invite the soldier never got mailed. On the day of the scheduled dinner, another soldier is brought to their home and love soon blossoms between him (Hodiak) and Tessa (Baxter), the young woman who runs the home.	romance
A naive woman (Hunter) comes to New York City to meet her salesman husband (Jagger) whom she only met months before, and discovers that he may be a murderer.	film noir
Tough reporter Kenny Blake (Beaumont) falls in love with sultry Toni Kirkland (Savage) who is married to a much older man (Hicks). She seduces him to murder her husband. City editor Ward McKee (Brown), Kenny's boss and best friend, begins to pursue the tangled threads of the crime relentlessly and gradually closes the net on Kenny. In the end Tony and Kenny shoot each other. As he dies, Kenny types out his confession to the crime.	crime drama
Three witnesses swear they saw Joe Reynolds murder grumpy baker Kenny (Ben Welden) with a hatchet. Joe claims Kenny's fatal head wound was the result of a fall as they argued—the baker hit his head on an oven as he fell—but the eyewitness testimony prevails and Joe is sentenced to death in the electric chair. His buddy Sam Lord has an uphill struggle to prove his innocence.	crime
The film, based on a story by former crime reporter Martin Mooney, is about a newspaper journalist who faces prison time because he refuses to name his sources. To complicate matters more, the reporter falls in love with the sister of one of the racketeers he's trying to take down.	thriller
A woman who has been married and divorced five times comes back to her small hometown, where she proceeds to complicate, and potentially destroy, the marriage of her childhood boyfriend.	drama
"During World War II, a San Francisco nurse dreams of a murder and then meets the ""victim"" in real life. What she saw in the dream helps her in an effort to thwart enemy spies."	film noir
When a prominent fashion model is murdered, a stockboy accused of the crime must clear his name, working with another model.	film noir
A merchant ship captain (George Raft) finds his father's ship – of the same line – derelict at sea, the entire crew having disappeared. From an unlisted passenger (Signe Hasso), the only survivor of the hijacking of the ship, he learns of a plot involving secret gold, and searches New Orleans for his father's murderer.	drama
A scientist, Dr. Karell (Asther), has found a way to prolong life (he is 120 years old) with the help of Dr. Van Bruecken (Schünzel). However, Dr. Karell has now fallen in love, and has discovered that if he doesn't get new glands, he will die.	drama
The film examines small town hypocrisy.	drama
Midnight Manhunt begins with the shooting death of a master criminal who expires in a wax museum. Reporter Sue Gallagher (Ann Savage) is first on the scene, but she is soon in competition with her boyfriend, fellow reporter Pete Willis (William Gargan). The killer traps Sue in the wax museum when he returns there looking for the body. Leo Gorcey plays the caretaker of the wax museum.	film noir
Attorney Wayne Fletcher (Chaney, Jr.) intends to divorce his wife and marry his secretary (Joyce), who comes from a wealthy family. When the wife is found suffocated to death, he naturally becomes the suspect. As others are killed in the same manner and a phony medium (Bromberg) also claims Fletcher is guilty, Fletcher begins to imagine his dead wife is communicating with him, making it even more difficult for him to prove his innocence.	horror
Young, lovely Naila becomes queen of the ancient Egyptian kingdom of Khemis when her father is killed in a slave revolt. Continuing her penchant for going incognito among the people, she seeks out rebel leader Herua. But through palace treachery, she herself is captured and enslaved. After various adventures, she finds herself rescued by (and attracted to) the very rebel she was seeking. Will gratitude or revenge win out? Gorgeous scenery and costumes.	adventure
An amnesiac (Tom Conway), accused of murder searches for the truth with the help of a cabbie, Patty Mitchell (Ann Rutherford). The story is essentially a remake of Two in the Dark (1936).	film noir
A falsely convicted man's wife, Catherine (June Vincent), and an alcoholic composer and pianist, Martin (Dan Duryea), team up in an attempt to clear her husband of the murder of a blonde singer, Mavis Marlowe (Constance Dowling), who had been Martin's wife. Their investigation leads them to face-to-face confrontations with a determined policeman, Captain Flood (Broderick Crawford), and a shifty nightclub owner, Mr. Marko (Peter Lorre), who Catherine and Martin suspect may be the real killer.	film noir
Claudia (Dorothy McGuire), still charmingly naive and a bit nervous, is struggling with the responsibilities of marriage and parenthood in their rural Connecticut town. Jealousy creeps into the relationship when Elizabeth (Mary Astor) starts consulting David on a building project, while Claudia is attracting the uninvited attentions of Phil (John Sutton), who happens to be married.[3]	drama
Jeff (Tom Drake) arrives home to New York City after being away in the Navy for several years. Unaware that his fiancée, Jean (Donna Reed), is now dating a man (Warner Anderson) at the department store where she works, Jeff assumes she is still intends to marry him. In order to save Jeff from heartache, several employees at Jean's store set up a ruse to keep Jeff unaware of Jean's new man until he is deployed again. Jean cooperates with the ruse, but it isn't long before secrets get revealed.	romance
A broke medical student in desperate need of tuition money sells everything he owns to a dishonest professor. When the student's scholarship is suddenly taken from him, he flies into a rage and kills the professor, whom he feels is responsible for his situation. His life then begins to improve, but as the student grows more reckless, police suspicion continues to grow.	drama
A reporter marries a dying girl for her money, but she recovers from her illness so he plots her murder.	drama
An ex-con has a choice of losing his job or participating in a robbery.	crime
A nursing student falls in love with a young medical intern in 1910 Baltimore, but their lives start to fall apart when he catches a deadly disease.	romance
A young girl gets a flat tire, and ends up with her car being stolen. Later, her car is involved in an accident which results in a man's death. The gangsters who stole the car plant the body in her car to make it look like she was at fault.	film noir
The film tells the tale of a man called George Taylor (John Hodiak), who returns home to the U.S. from fighting in World War II. He is suffering from amnesia, and tries to find his old identity, following a trail left behind by the mysterious Mr. Larry Cravat. He ends up stumbling into a murder mystery involving Nazi loot.	film noir
In Tangier, disgraced American war correspondent Paul Kenyon, cafe dancer Rita, and local entrepreneur Pepe, team up to battle Adolpho Fernandez, a Nazi diamond smuggler.	thriller
Howard Young is a coast guardsman who has been on shore duty for three years despite his efforts to be sent into action. His nearest approach to sea duty was on a harbor-moored life raft for 21 days as part of an experiment with a new type of vitamin gum for the government. He meets Christine Bradley, a SPAR, sent to take over his communications job and, by things he leaves unsaid, she thinks his life-raft experience was the result of a ship-wreck at sea.	action
Victorian melodrama, set in Egypt, where a down-on-her-luck courtesan (Oberon) snares a loving but naive Egyptologist (Brent), marries him and moves to Egypt. She quickly becomes bored and embarks on an affair with Mamhoud Baroudi (Korvin). She falls in love with him, and together, they plot to do away with her husband.	drama
Ann Hamilton (Katharine Hepburn) is a middle-aged bride who begins to suspect that her charming husband Alan Garroway (Taylor) plans to murder her. Neither can she ignore her brother-in-law, Michael Garroway (Mitchum), whom she has never met, but has been told so much about.	film noir
Relatives arrive for the reading of a will at a creepy mansion. Is someone is trying to murder Nina Arnold (Jeff Donnell) to claim a share of her grandmother's legacy, her grandmother who she never met? Could that someone be her emotionally unstable mother Rachel Martin (Karen Morley), from who she was taken when she was a baby? Investigators Jack Packard (Jim Bannon) and Doc Long (Barton Yarborough) are put on the case.	drama
"Jeff Cairn enlists in the Navy. He puts younger sister Nella in a cousin's care, but she misses the boarding house where they lived and where old Henry Pecket let her work on his sloop, docked out back.
A waitress, Jeff's sweetheart Jenny, agrees to move into Sara March's boarding house to look after the girl. Sara mistakenly believes Henry is inviting women aboard his boat. Jeff is reported to be missing in action, while the sloop eventually sets out to sea and is caught in a storm."	drama
A shamus is approached by an entertainment executive to stop a blackmail plot against him.	crime
"Private detective Philip Marlowe is hired by a wealthy widow, Elizabeth Murdock, to find a stolen coin called the Brasher Doubloon.
Marlowe ends up in the middle of a much more complicated case, one that involves blackmail and murder, forcing him to deal with a number of strange individuals. That includes Merle Davis, a deranged secretary to Murdock, whose own role in the matter is considerably more sinister than it seems."	crime drama
Red North is a bush pilot in the village of Nouvelle, part of Canada's north. His half-brother, Paul Gerard decides to relocate his bush pilot business to the same lake, competing with Red's business and romantic interests.	drama
Dr. Gillespie (Barrymore) asks a young surgeon, Dr. Tommy Coalt (Craig), to go to the small town of Bayhurst to replace a local doctor while he is on assignment to the Occupation effort in post-World War II Europe. There, Coalt is asked to sign mental-health commitment papers on a beautiful young socialite, Cynthia Grace (Bremer). Coalt thinks there is something amiss, and begins his own investigation.	drama
Steve Morgan (Tierney) is a charming sociopath who has just robbed and killed a cinema cashier. Seeking to escape, he hitches a ride to Los Angeles with unsuspecting Jimmy 'Fergie' Ferguson (North). Part way the pair stops at a gas station and picks up two women. Encountering a roadblock, Morgan persuades the party to spend the night at an unoccupied beach house. The police close in as one by one Morgan begins killing the threesome.	drama
Newspaperman is caught in the middle of a ruthless city power struggle.	crime
"""Illustrated Press"" society editor Lorelei Kilbourne (Hillary Brooke) is assigned to a police case. Her crusading newspaper editor Steve Kilgore suspects that hard-luck suspect Harry Hilton (Frank Wilcox) has been framed on a murder rap. Lorelei and Steve proceed to help the police solve the crime, at the same time uncovering a conspiracy to bring a building firm to bankruptcy."	drama
A man runs away to avoid suspicion of murder and ends up in more trouble.	crime drama
A woman fears her new husband will kill her.	drama
The Crime Doctor, Dr. Robert Ordway (Warner Baxter), an amnesiac ex-crook, takes on yet another intriguing psychological murder case. This time he is on vacation, but the kindly fellow cannot help but look into a murder to help a troubled soul.[2]	crime
Ann Mason (Coleman), an undercover reporter, develops amnesia after infiltrating a neo-fascist group.	crime
Crusty Dr. McRory (Barry Fitzgerald) of Fallbridge, Maine, hires a replacement for his vacation sight unseen. Alas, he and young singing doctor Jim Pearson (Bing Crosby) don't hit it off, but Pearson is delighted to stay, once he meets teacher Trudy Mason (Joan Caulfield). The locals, taking their cue from McRory, cold-shoulder Pearson, especially Trudy's stuffy fiancée. But then, guess who needs an emergency appendectomy.[4]	drama
"Two years after her husband's death, Christine Faber (Lynn Bari) thinks she hears her late husband (Donald Curtis) calling out of the surf on the beach one night. She meets a tall dark man named Alexis (Turhan Bey) who seems to know all about her.
After more ghostly manifestations, Christine and her younger sister (Cathy O'Donnell) become enmeshed in the strange life of Alexis; but he in turn finds himself manipulated into deeper devilry than he had in mind."	thriller
This account of a violent prison break is a semi-documentary opens with a newsreel type tour of the prison. Led by Carl Schwartzmiller (Jeff Corey), 12 convicts plan their escape but prisoner Jim Sherbondy (Scott Brady) is reluctant to go along with the group.	crime
A getaway car, leaving the scene of a murder, strikes and injures a woman. Afterward, the driver visits her in the hospital.	drama
