sentence	label
A bartender is working at a saloon, serving drinks to customers. After he fills a stereotypically Irish man's bucket with beer, Carrie Nation and her followers burst inside. They assault the Irish man, pulling his hat over his eyes and then dumping the beer over his head. The group then begin wrecking the bar, smashing the fixtures, mirrors, and breaking the cash register. The bartender then sprays seltzer water in Nation's face before a group of policemen appear and order everybody to leave.[1]	unknown
The moon, painted with a smiling face hangs over a park at night. A young couple walking past a fence learn on a railing and look up. The moon smiles. They embrace, and the moon's smile gets bigger. They then sit down on a bench by a tree. The moon's view is blocked, causing him to frown. In the last scene, the man fans the woman with his hat because the moon has left the sky and is perched over her shoulder to see everything better.	unknown
"The film, just over a minute long, is composed of two shots. In the first, a girl sits at the base of an altar or tomb, her face hidden from the camera. At the center of the altar, a viewing portal displays the portraits of three U.S. Presidents—Abraham Lincoln, James A. Garfield, and William McKinley—each victims of assassination.
In the second shot, which runs just over eight seconds long, an assassin kneels feet of Lady Justice."	unknown
The film is about a family who move to the suburbs, hoping for a quiet life. Things start to go wrong, and the wife gets violent and starts throwing crockery, leading to her arrest.	comedy
Scenes are introduced using lines of the poem.[2] Santa Claus, played by Harry Eytinge, is shown feeding real reindeer[4] and finishes his work in the workshop. Meanwhile, the children of a city household hang their stockings and go to bed, but unable to sleep they engage in a pillow fight. Santa Claus leaves his home on a sleigh with his reindeer. He enters the children's house through the chimney, and leaves the presents. The children come down the stairs and enjoy their presents.	unknown
"The plot is that of a black woman going to the dentist for a toothache and being given laughing gas. On her way walking home, and in other situations, she can't stop laughing, and everyone she meets ""catches"" the laughter from her, including a vendor and police officers."	comedy
A young couple decides to elope after being caught in the midst of a romantic moment by the woman's angry father. They make plans to leave, but a thief discovers their plans and hides in their trunk and waits for the right moment to steal their belongings.	comedy
"A white girl (Florence Lawrence) rejects a proposal from an Indian brave (Charles Inslee) in this early one-reel Western melodrama. Despite the rejection, the Indian still comes to the girl's defense when she is abducted by his warring tribe. In her first year in films, Florence Lawrence was already the most popular among the Biograph Company's anonymous stock company players. By 1909, she was known the world over as ""The Biograph Girl."""	adventure
A rejected admirer sets up a trap to kill his sweetheart and her fiance before they married and then commit suicide, but before he passes away, he leaves a confession. Fortunately the confession is found on time and a police man runs to the church to save the couple.	drama
An old woman sends a girl begging in the streets of Paris on a snowy evening. Callous revelers pass her by, and she falls asleep before one donor finally drops a golden Louis in her shoe. A gambler with a sure tip on roulette but no cash borrows the coin to win a fortune for the girl. She wakes, and the two miss each other wandering the streets until the gambler finds the girl dead.	drama
"The story as told by Moving Picture World reads:
"	unknown
Mary Pickford plays Priscilla an unemployed maid who finds work at a farm. There she meets a no-good peddler who starts flirting with her and makes her fall in love with him. He runs up a gambling bill and asks her to help him pay his debts or he won't be able to marry her.[1]	drama
The day before Christmas, Ebenezer Scrooge refuses to contribute to the Charity Relief Committee, and then rudely rejects his nephew Fred when he visits Scrooge in his office. When Scrooge returns home, he sees the ghost of his former business partner Jacob Marley, who warns him of the punishment he will suffer in the next life if he does not change his ways. That night, Scrooge is visited by three more spirits, who show him his past, present, and future him.	unknown
"Described as ""a liberal adaptation of Mrs. Shelley's famous story"", the plot description in the Edison Kinetogram was:[3]"	unknown
During the American Civil War a young soldier loses his nerve in battle and runs away to his home to hide; his sister puts on his uniform, takes her brother's place in the battle, and is killed. Their mother, not wanting the shameful truth to become known, closes all the shutters (hence the film's title) and keeps her son's presence a secret for many years, until two boyhood chums stumble upon the truth.	drama
An Irish boy (Olcott) emigrates to America to escape the desperate poverty of Ireland. After finding work in construction, he finds success in politics. He returns to Ireland after receiving a letter from his sweetheart (Gauntier) just as her destitute family is being forced off their land.[3]	drama
"""David Copperfield consists of three reels and as three separate films, released in three consecutive weeks, with three different titles: The Early Life of David Copperfield, Little Em'ly and David Copperfield and The Loves of David Copperfield.[4]"	drama
Polly Biblett (Mary Pickford), a young lady, tells her grandmother Lettie about her new boyfriend. The news provokes the elderly woman to reminisce about her own sweetheart, long time before. The touching sequence expresses the power of lives going on, the older woman aging as her grandchildren grow and knowing they will soon have children of their own.	drama
The story concerns a soldier who deserts his regiment and encounters a wagon train of settlers. When finding an attack by American Indians is eminent, he returns to his unit in order to elicit help.	unknown
Only lasting 15 minutes, it is a light-hearted comedy about the battle between the sexes as several married couples go on a camp-out together. The women soon realize that the men expect them to do perform all of the work while they relax, leading to several comedic situations.	comedy
The story is of an English manufacturing town {Huddersfield} in which Henry Little, a worker and inventor, is persecuted by trade unions, jealous because he was better trained than his fellows. Squire Raby, Little's uncle, is a forcible character, and a pleasant love story offsets the labor troubles. A purpose of the novel was to expose, without censure, the errors of early trades unions.	drama
Barney Oldfield races a speeding locomotive to rescue a damsel in distress tied up on the tracks by evil villain Ford Sterling.	comedy
Bob, a typically devoted husband, is told by his wife that the stork has paid a visit to their household; the first time, it turns out to be a puppy; the second time, expecting another canine, he is surprised to find the more traditional offspring.	comedy
The Evidence of the Film tells the story of a messenger boy at a film studio who is wrongfully accused of stealing bonds worth $20,000. He is saved by his sister, a film cutter, who comes across some footage of her brother inadvertently walking into a location shot and being knocked down by the real-life villain.	crime
"As described in a 1913 blurb: ""The foreman of the sawmill misconstrues the disappearance of his ward who has taken drastic measures to protect her guardian's interests. A startling incident reveals the girl's motive.""[2]"	drama
In A Busy Day, a wife (played by an energetic Charlie Chaplin) becomes jealous of her husband's interest in another woman during a military parade. On her way to attack the couple, the wife interrupts the set of a film, knocking over a film director and a police officer. Finally, the husband pushes the wife off a pier and she falls into the harbor.	comedy
"Graehme, Ned Stewart's father was accused of adultery and killed being innocent. Ned decided to avenge his father, but got captured and sent to the long journey to death ""la longue traverse"". Fortunately Virginia saves his life and the story's villain confesses Ned's innocence."	adventure
Chaplin plays a waiter who fakes being a Greek Ambassador to impress a girl. He then is invited to a garden party where he gets in trouble with the girl's jealous boyfriend. Mabel Normand wrote and directed comedies before Chaplin and mentored her young co-star.	comedy
Mabel and her beau go to an auto race and are joined by Charlie and his friend. As Charlie's friend is attempting to enter the raceway through a hole, the friend gets stuck and a policeman shows up.	comedy
Pug, a down-and-out hobo, is talked into pretending he is Cyclone Flynn, the boxing champion, and entering the ring for a fight. When the real Cyclone shows up, Pug ends up having to trade punches with him instead.	comedy
Mabel's Blunder tells the tale of a young woman who is secretly engaged to the boss's son.[1] The young man's sister comes to visit at their office, and a jealous Mabel, not knowing who the visiting woman is, dresses up as a (male) chauffeur to spy on them.	comedy
In a hotel lobby a heavily drunk tramp runs into an elegant lady, Mabel, who gets tied up in her dog's leash, and falls down. He later runs into her in the hotel corridor, locked out of her room. They run through various rooms. Mabel ends up in the room of an elderly husband where she hides under the bed. Enter the jealous wife, who soon attacks Mabel, her husband, and Mabel's lover, not to mention the staggeringly drunken tramp.	comedy
"Esra Kincaid (La Reno) takes land by force and, having taken the Espinoza land, his sights are set on the Castro rancho. US government agent Kearney (Johnston) holds him off till the cavalry shows up and he can declare his love for Juanita ""The Rose of the Rancho"" (Barriscale)."	western
Rough-and-tumble Gold Rush-era California: a woman (Salomy Jane) is saved from a ruffian (Red Pete) by a heroic stranger (Jack Dart), the latter saved from a lynching when falsely accused of a crime.	western
The stories revolved around the inhabitants of the fictitious land of 'Bluffoonia' and their ongoing struggle against the evil tyrant 'Clandestino' and his plans to destroy the forest in which they live.	unknown
Don José, an officer of the law, is seduced by the gypsy girl Carmen, in order to facilitate her clan's smuggling endeavors. Don José becomes obsessed, turning to violent crime himself in order to keep the attention of Carmen.	adventure
Considered a coward by his fiancée and comrades in arms, a British army officer has to redeem himself.	drama
A farm youth goes to college, pursues the pretty co-eds and joins a fraternity.	comedy
Luke (Harold Lloyd) works in a shoe store, but has difficulty focusing on work when a pretty girl is near.	comedy
A young sculptor searches for the perfect model to inspire his work. He finds a poverty-stricken girl who he thinks is the one he has been looking for. When she wanders off, he visits all the famous statues in Manhattan hoping to find her again.	unknown
As the American Civil War begins, Ned Burton leaves his Southern love, Agatha Warren, and joins the Union army. He is later protected and saved from death by Agatha in spite of her loyalty to the South.	drama
A sultan agrees to help an evil witch destroy a mysterious beauty if the witch will bring his young son back to life.	drama
Hoping to improve his financial lot, petty thief Hawk Chovinski (McGrail) hires a dancing instructor to teach him how to bear himself like a gentleman. His lessons completed, Hawk then poses as a European nobleman, intending to trap a wealthy wife. Yolande Cowles (Baird) sees through Hawk's pose but falls in love with him anyway.	drama
A woman is thrown out of her home by her jealous husband and sinks into depravity. Twenty years later, she finds herself accused of murder for saving her son, who does not know who she is. He finds himself defending her without knowing her background.	drama
Nadia, the daughter of a nobleman, rejects ancient Greece's senator Theron's love; so he has her and her lover, Lucian thrown into a burning crater. As punishment for this sin, the gods decree that he will roam the earth as a lion until he can right his wrong. A few millennia later, Nadia is now Agnes, the daughter of a millionaire, and Lucian is Arthur, a Wall Street broker.	drama
Mary Beresford (Boland) is the wife of unambitious law clerk Al Beresford (Beresford). Thanks to Mary's tenacity and carefully calculated social-climbing, Al is promoted to the position of personal secretary of prominent financier Elihu Knowland (Keenan). Unfortunately, success goes to Al's head like a narcotic, and soon he has alienated everyone in New York, including Mary, who runs off for parts unknown.	drama
The film is about a court case and embezzlement.	drama
A father takes his daughter on a trip to Bermuda in an attempt to separate her from a suitor. Little does anyone know that the suitor has stowed away on board. When he is discovered, he is credited with catching a crook. The hapless hero receives a reward, and also the girl.	comedy
A young boy, Pip, runs into an escaped convict at his local churchyard. Pip does favours for Magwitch (the convict), such as bringing him food etc. until Magwitch is eventually arrested and deported to Australia.	drama
A young man drowns his sorrows in strong drink when jilted by his girl. His drunkenness gets him thrown in jail, where he falls in love with the jailer's daughter. When released, the young man tries everything to get back into the jail - though when he is mistaken for an anarchist bomber, he finds himself facing not just jail, but execution.	comedy
As described in a film magazine review,[3] Neil Dacey (Carrigan) loves Peggy Desmond (Taliaferro). Terence O'Malley (Sack), nephew of Squire O'Malley (Ryan), is anxious to win Peggy. Terence and his uncle have a quarrel because Terence cannot win Peggy, and the squire is killed. Terence does the killing with Neil's gun, so Neil is held for the murder. Peggy, to save her fiance, dresses as the will-o'-the-wisp, and this results in a confession by Terence.	drama
As described in a film magazine,[4] Rebecca Randall (Pickford) is taken into the home of her aunt Hannah (Eddy), a strict New England woman. Rebecca meets Adam Ladd (O'Brien), a young man of the village, and they become great friends. One day Rebecca promises to marry Adam when she becomes of age. Unable to withstand her pranks any longer, her aunt sends her away to a boarding school. She graduates a beautiful young lady. Shortly thereafter, Adam demands a fulfillment of her promise.	drama
A philandering husband's public flirtation with a beautiful girl—and the resulting brawl with the woman's boyfriend—are captured by a newsreel cameraman. When the husband takes his wife and her mother out to the movies, the footage is shown on-screen. The husband tries to flee the theater, only to be spotted and leaped upon by the woman's boyfriend, treating viewers to two simultaneous fights between the same two men, both on-screen and in the aisle.	comedy
At the end of the 19th century in the Far West, a farmer is fighting for his right to plough the plains. In order to expel the farmers, the ranchers try to control access to water.[2]	western
As described in a film magazine,[2] Moctezuma (Hatton), the Aztec king, resents the intrusion of the Spanish who have come to convert the Aztecs to Christianity. As Tecza (Farrar), daughter of the king, loves Alvarado (Reid), one of the Spanish captains, she allows the Spanish soldiers to enter the palace. After a terrific battle, she is the only surviving Aztec and the Spanish allow her to depart in peace. Alvarado then comes wooing the last of the Aztecs and wins her.	romance
"Con artists Harold (Harold Lloyd) and Snub (Snub Pollard) try to con the ""not easily outwitted"" Miss Goulash (Bebe Daniels) and her father."	comedy
As described in a film magazine,[3] George Travelwell (Fairbanks), an American youth motoring in Morocco, discovers that the governor of El Harib (Campeau) has seized a young American woman for his harem. Disguised as an inmate of the harem, George nearly wrecks the place while he rescues her. One thrilling incident follows upon the heels of another in their attempts to get away, and it ends with him setting one tribe against another, leaving them free to peacefully ride away.	unknown
The plot centers around an inter-racial romance between a Chinese princess (Talmadge) and an American (Meighan). When palace officials discover she has become pregnant she is sentenced to death. In the latter part of the film Talmadge plays the now adult daughter of the affair, seeking her father in the Philippines.	drama
A young girl suddenly finds herself wealthy, but lacking in social graces. She calls upon the disinherited son from a wealthy family for help.	comedy
"Socialite but penniless orphan Lily Bart is living with her wealthy aunt who insists that she takes upon herself a rich husband. Balking at this idea and remaining faithful to her impecunious sweetheart Lawrence Selden (Henry Kolker), Lily is desirous of maintaining her luxurious lifestyle: she accepts the financial ""favors"" of some married millionaires but refuses to surrender her virtue in return – until she discovers that her sainted Selden has been fooling around with another man's wife."	drama
As described in a film magazine,[2] determined to lay down her life if necessary for her country, Princess Marya (Storey) mobilizes an army of Russian peasant women and is stationed in one of the front line trenches. German forces are about to overrun her battery when American volunteers arrive, and the Germans are dispelled. With autocracy abolished in Russia, Marya consents to become the wife of American Captain Rodney Willard (McCullough).	drama
Bebe plays a pretty young thing with several suitors, including Harold, competing to win her affections.	comedy
During World War I, a professional thief known as The Lone Wolf (Henry B. Walthall) is assigned to steal a cylinder with important information from behind the German lines and bring it to Allied intelligence headquarters. However, German agents set out to stop him, headed by the dreaded Eckstrom (Lon Chaney), the man who was responsible for slaughtering the Lone Wolf's sister and her family.	drama
"A young man (Fay) goes out to eat breakfeast with his friend (Harrison). As a restaurant ""regular"" with a pistol threatens to eat everyone's bacon, the two friends flee."	comedy
"According to a contemporary New York Times article, the first half of the film shows ""Armenia as it was before Turkish and German devastation, and led up to the deportation of priests and thousands of families into the desert. One of the concluding scenes showed young Armenian women flogged for their refusal to enter Turkish harems and depicted the Turkish slave markets.""[2] The story was adapted for the screen by Henry Leyford Gates, who also wrote the book.[3]"	drama
Martin Wingrave(Barrymore) is arrested and sent to prison for seven years for a crime he didn't commit. While incarcerated he learns that his girlfriend and her male accomplice framed him for the crime. When Wingrave is released he plots revenge against his former girl and her man(Manon, Schable). However he begins a romance with his neighbor, a young woman(Binney) who truly loves him and warms his heart.	drama
Based upon a plot summary in a newspaper,[3] Amy (Bennett) is married to a cad but visits another man who loves her and helps her endure her marriage. After a confrontation and struggle between the men which leads to a death, Amy stands accused of the murder.	drama
Captain Bob White, an American aviator behind enemy lines, disguises himself as a woman in order to fool and steal an important map from the members of the German High Command, including the Kaiser himself.	comedy
The film revolves around a young woman who sleepwalks and the doctor who is attempting to treat her. The climactic scene involves the young woman sleepwalking precariously on the outside ledge of a tall building, anticipating Lloyd's more famous skyscraper-scaling scenes in Safety Last! (1923). A subplot has Lloyd and his friend getting inebriated on homemade liquor and then trying to avoid a prohibition-era policeman who pursues them for being drunk.	comedy
As described in a film publication,[2] a youth (Arthur Rankin) in the prologue seeks advice from his grandfather (Sydney), who then recalls a romance of his own youth which is then shown as a flashback. A priest (Sydney) is in love with an Italian opera singer (Keane), and the drama involves the conflict between his efforts to rise above worldly things or to leave with her. The romance ends with a deep note of pathos.	romance
"Socialite Anatol Spencer (Reid), finding his relationship with his wife (Swanson) lackluster, goes in search of excitement.
After bumping into old flame Emilie (Hawley), he leases an apartment for her only to find that she cheats on him. He is subsequently robbed, conned, and booted from pillar to post. He decides to return to his wife and discovers her carousing with his best friend Max (Dexter)."	drama
As described in a film magazine,[4] country girl Eileen (Lee) comes to New York City to make her career on the stage. She is rescued from want by Pop O'Malley (Ogle), an aged actor who works as a door keeper, and finds employment in the chorus. Larry Taylor (Holt), a wealthy man-about-town, seeks to win her without benefit of clergy. She falls in love with him and, against Pop's instructions, goes to his house. Knowing what awaits her there, Pop follows her with a resulting dramatic ending.	unknown
The plot of Experience was summarized in the August 1921 issue of Photoplay magazine.	drama
"Peter Ibbetson (Reid) is an orphan raised by his uncle, Colonel Ibbetson. When the Colonel insults his dead mother, Peter attacks him and is ordered from the house. Then the young man runs into his childhood sweetheart, Mimsi (Ferguson), and their romantic feelings are rekindled.
Unfortunately, Mimsi has married, but they carry on a love affair in their dreams. Their dream-affair continues over the years, even after Peter kills her husband, the Duke of Towers, and gets a life prison sentence."	romance
The Boy meets and marries The Girl. A year later, the two walk down the street with a baby carriage carrying a bottle instead of a baby when they run into The Girl's brother who asks the couple to do him a favor and babysit his children. They accept and the remainder of the short consists of gags showcasing the difficulties of babysitting children. At the very end, The Boy discovers some knitted baby clothes in a drawer (implying that The Girl is pregnant).	comedy
"A girl (Wilson) is held at mercy of gang of crooks, her only friend being a ""half-wit"". A murder is committed and blame shifted to the girl.
The ""half-wit"" has seen the murder, but cannot remember. When he is cured, his testimony frees the girl."	unknown
As described in a film publication,[4] the story involves an underworld plot to defraud givers to a charity for French orphans. Jenny Dark (Johnstone), who greatly admires Joan d'Arc, supposedly the wife of a French officer, at a banquet collects $200,000 for the French orphans. Jenny's father Jim (Hatch) is a plain clothes man, so the crooks do not get away. However, when Jim goes to arrest the impostor, he finds his daughter Jenny in the room with him. However, soon all is explained.	comedy
"The Sky Pilot (Bowers) arrives in a small rough-and-tumble cattle town in the north, intent on bringing religion to its tough residents. At first they reject him, but in time he wins the residents over with his prowess. A plot to steal cattle is uncovered and disrupted. Gwen, daughter of the ""Old Timer,"" is injured in a stampede, loses her ability to walk, but recovers thanks to the power of love."	drama
When an underworld figure inherits a fortune, he goes straight and endeavors to become a respectable businessman. But on a trip to Paris, he encounters a few not-so-honest types who think he is ripe for picking.	unknown
An Indian maid and American girl (both played by Florence Vidor) share a single soul which shifts between them each day when they are awake.[3]	drama
Keaton plays a botany student who is accidentally awarded an electrical engineering degree. He then attempts to wire a home using many gadgets. The man to whom the degree should have been awarded then exacts revenge by rewiring those gadgets to cause mayhem.	comedy
"The grandma's boy is a timid coward who cannot muster courage to woo his girl and is afraid of his rival. His loving grandma gives him a magic charm from the Civil War that had been used by his grandfather, which gives him the courage to capture a town criminal and win the girl. The ""magic charm"" turns out to be the handle of her umbrella and his grandma was pretending it was magical all along."	comedy
A wild, wealthy woman (Joy) is brought to heel by a sermonizing district attorney after she accidentally hits and kills a motorcycle cop.	drama
Seven-year-old Jackie Blair (Coogan), the son of poor immigrants, is orphaned and, leaving Ellis Island, finds his way into the home of a hardbitten ex-seaman, Captain Bill. Despite his initial misgivings, the Captain grows fond of the boy. Tension mounts when officials attempt to take Jackie away for deportation, and the Captain tries to find a way to keep him safe.[1]	unknown
